{
  "schema_version": 1,
  "project": {
    "name": "marginshot",
    "root": "."
  },
  "source_files": [
    "SPECS.md"
  ],
  "tasks": [
    {
      "id": "T001",
      "title": "Create iOS project scaffold and two-mode navigation",
      "priority": 1,
      "status": "done",
      "details": "Set up the app shell with a horizontal swipe container for Capture and Chat plus a header showing mode and sync status.",
      "tags": [
        "ui",
        "app-structure"
      ],
      "steps": [
        "Create the Xcode project and app entry point",
        "Implement a swipe container between Capture and Chat",
        "Add a minimal header with mode label and sync status icon"
      ],
      "updated_at": "2026-01-20T14:32:03Z",
      "files": [
        "MarginShot.xcodeproj/project.pbxproj",
        "MarginShot/Assets.xcassets/AppIcon.appiconset/Contents.json",
        "MarginShot/Assets.xcassets/Contents.json",
        "MarginShot/ContentView.swift",
        "MarginShot/Info.plist",
        "MarginShot/MarginShotApp.swift",
        "MarginShot/Views/CaptureView.swift",
        "MarginShot/Views/ChatView.swift",
        "MarginShot/Views/HeaderView.swift",
        "to-do.json"
      ]
    },
    {
      "id": "T002",
      "title": "Implement onboarding and permissions flow",
      "priority": 1,
      "status": "done",
      "details": "Show a welcome screen, request camera (and optional photos) permissions, and handle denial paths.",
      "tags": [
        "ui",
        "permissions"
      ],
      "depends_on": [
        "T001"
      ],
      "updated_at": "2026-01-20T14:40:59Z",
      "files": [
        "MarginShot.xcodeproj/project.pbxproj",
        "MarginShot/ContentView.swift",
        "MarginShot/Info.plist",
        "MarginShot/Views/OnboardingView.swift",
        "to-do.json"
      ]
    },
    {
      "id": "T003",
      "title": "Bootstrap the vault filesystem and base structure",
      "priority": 1,
      "status": "done",
      "details": "Create the default vault folder tree, SYSTEM.md, INDEX.json, and STRUCTURE.txt with atomic file writes.",
      "tags": [
        "storage",
        "vault"
      ],
      "depends_on": [
        "T001"
      ],
      "updated_at": "2026-01-20T14:46:52Z",
      "files": [
        "MarginShot/ContentView.swift",
        "to-do.json"
      ]
    },
    {
      "id": "T004",
      "title": "Define the local data model and persistence layer",
      "priority": 1,
      "status": "done",
      "details": "Model Batch, Scan, Note, SyncState, Index, and Notebook entities using Core Data or SQLite with migrations.",
      "tags": [
        "data",
        "storage"
      ],
      "depends_on": [
        "T001"
      ],
      "updated_at": "2026-01-20T14:53:41Z",
      "files": [
        "MarginShot.xcodeproj/project.pbxproj",
        "MarginShot/ContentView.swift",
        "MarginShot/MarginShotApp.swift",
        "MarginShot/PersistenceController.swift",
        "to-do.json"
      ]
    },
    {
      "id": "T005",
      "title": "Build the capture camera and scanning pipeline",
      "priority": 1,
      "status": "done",
      "details": "Live camera preview with document detection, auto-crop, deskew, enhancement, and local image storage.",
      "tags": [
        "capture",
        "vision"
      ],
      "depends_on": [
        "T001",
        "T004"
      ],
      "updated_at": "2026-01-20T15:04:43Z",
      "files": [
        "MarginShot/Views/CaptureView.swift",
        "to-do.json"
      ]
    },
    {
      "id": "T006",
      "title": "Add batch capture and inbox management UI",
      "priority": 1,
      "status": "done",
      "details": "Create batch sessions, track scan status, show inbox count, and allow review/retry of failed items.",
      "tags": [
        "capture",
        "inbox",
        "ui"
      ],
      "depends_on": [
        "T004",
        "T005"
      ],
      "updated_at": "2026-01-20T15:18:44Z",
      "files": [
        "MarginShot/Views/CaptureView.swift",
        "to-do.json"
      ]
    },
    {
      "id": "T007",
      "title": "Implement processing queue and background tasks",
      "priority": 1,
      "status": "done",
      "details": "Queue processing per notebook, schedule BGTaskScheduler jobs, and honor Wi-Fi/charging constraints.",
      "tags": [
        "processing",
        "background"
      ],
      "depends_on": [
        "T004",
        "T006"
      ],
      "updated_at": "2026-01-20T15:28:12Z",
      "files": [
        "MarginShot.xcodeproj/project.pbxproj",
        "MarginShot/ContentView.swift",
        "MarginShot/Info.plist",
        "MarginShot/MarginShotApp.swift",
        "MarginShot/ProcessingQueue.swift",
        "MarginShot/Views/CaptureView.swift",
        "to-do.json"
      ]
    },
    {
      "id": "T008",
      "title": "Integrate the Gemini LLM client",
      "priority": 1,
      "status": "done",
      "details": "Implement network client, auth configuration, retries/backoff, and response parsing.",
      "tags": [
        "llm",
        "network"
      ],
      "depends_on": [
        "T001"
      ],
      "updated_at": "2026-01-20T15:32:57Z",
      "files": [
        "MarginShot.xcodeproj/project.pbxproj",
        "MarginShot/GeminiClient.swift",
        "MarginShot/Info.plist",
        "to-do.json"
      ]
    },
    {
      "id": "T009",
      "title": "Build transcription, structure, and classification pipeline",
      "priority": 1,
      "status": "done",
      "details": "Support fast/balanced/best modes, validate JSON outputs, and preserve raw transcripts.",
      "tags": [
        "llm",
        "processing"
      ],
      "depends_on": [
        "T007",
        "T008"
      ],
      "updated_at": "2026-01-20T15:47:19Z",
      "files": [
        "MarginShot.xcodeproj/project.pbxproj",
        "MarginShot/GeminiClient.swift",
        "MarginShot/PersistenceController.swift",
        "MarginShot/ProcessingPipeline.swift",
        "MarginShot/ProcessingQueue.swift",
        "to-do.json"
      ]
    },
    {
      "id": "T010",
      "title": "Implement vault writer and Markdown note generation",
      "priority": 1,
      "status": "done",
      "details": "Write daily notes, store scan images and transcripts, and apply file operations atomically.",
      "tags": [
        "vault",
        "processing"
      ],
      "depends_on": [
        "T003",
        "T009"
      ],
      "updated_at": "2026-01-20T15:58:42Z",
      "files": [
        "MarginShot/ProcessingPipeline.swift",
        "MarginShot/ProcessingQueue.swift",
        "to-do.json"
      ]
    },
    {
      "id": "T011",
      "title": "Create the indexer and local search store",
      "priority": 1,
      "status": "done",
      "details": "Maintain INDEX.json and STRUCTURE.txt, plus a SQLite FTS index for fast retrieval.",
      "tags": [
        "index",
        "search"
      ],
      "depends_on": [
        "T010"
      ],
      "updated_at": "2026-01-20T16:05:32Z",
      "files": [
        "MarginShot.xcodeproj/project.pbxproj",
        "MarginShot/ProcessingQueue.swift",
        "MarginShot/VaultIndexStore.swift",
        "to-do.json"
      ]
    },
    {
      "id": "T012",
      "title": "Implement retrieval for chat grounding",
      "priority": 1,
      "status": "done",
      "details": "Query index + FTS, expand via wiki-links, and build a context bundle for the chat agent.",
      "tags": [
        "chat",
        "search"
      ],
      "depends_on": [
        "T011"
      ],
      "updated_at": "2026-01-20T16:12:05Z",
      "files": [
        "MarginShot/VaultIndexStore.swift",
        "to-do.json"
      ]
    },
    {
      "id": "T013",
      "title": "Implement the chat agent and grounding rules",
      "priority": 1,
      "status": "done",
      "details": "Call the LLM with context and system rules, enforce grounded responses, and return sources metadata.",
      "tags": [
        "chat",
        "llm"
      ],
      "depends_on": [
        "T008",
        "T012"
      ],
      "updated_at": "2026-01-20T16:17:38Z",
      "files": [
        "MarginShot.xcodeproj/project.pbxproj",
        "MarginShot/ChatAgent.swift",
        "to-do.json"
      ]
    },
    {
      "id": "T014",
      "title": "Build the chat UI with sources disclosure",
      "priority": 1,
      "status": "done",
      "details": "Chat bubbles, input bar, typing indicator, and collapsible used sources with open actions.",
      "tags": [
        "chat",
        "ui"
      ],
      "depends_on": [
        "T013"
      ],
      "updated_at": "2026-01-20T16:28:42Z",
      "files": [
        "MarginShot/Views/ChatView.swift",
        "to-do.json"
      ]
    },
    {
      "id": "T015",
      "title": "Add the Ask about this capture-to-chat flow",
      "priority": 1,
      "status": "done",
      "details": "After finishing a batch, jump to chat and prioritize the latest batch context.",
      "tags": [
        "chat",
        "capture",
        "ui"
      ],
      "depends_on": [
        "T006",
        "T014"
      ],
      "updated_at": "2026-01-20T16:43:26Z",
      "files": [
        "MarginShot/ChatAgent.swift",
        "MarginShot/ContentView.swift",
        "MarginShot/ProcessingQueue.swift",
        "MarginShot/VaultIndexStore.swift",
        "MarginShot/Views/CaptureView.swift",
        "MarginShot/Views/ChatView.swift",
        "to-do.json"
      ]
    },
    {
      "id": "T016",
      "title": "Create settings screens and basic toggles",
      "priority": 1,
      "status": "done",
      "details": "Implement grouped settings for Processing, Sync, Organization, Privacy, and Advanced toggles.",
      "tags": [
        "settings",
        "ui"
      ],
      "depends_on": [
        "T001"
      ],
      "updated_at": "2026-01-20T16:49:07Z",
      "files": [
        "MarginShot.xcodeproj/project.pbxproj",
        "MarginShot/Views/CaptureView.swift",
        "MarginShot/Views/SettingsView.swift",
        "to-do.json"
      ]